{
  "$schema":"https://json-schema.org/draft/2020-12/schema",
  "type":"object", "additionalProperties":false,
  "required":["schema","status","materialized","noHostFallback","nativeAddons","runtime","fixedIdentity","loader","node","dsos"],
  "properties":{
    "schema":{"const":"shieldkit-labs/p2/gate-b/cohort-node-runtime-materialized/v1/source"},
    "status":{"const":"materialized-package-local"}, "materialized":{"const":true}, "noHostFallback":{"const":true}, "nativeAddons":{"const":false},
    "runtime":{"$ref":"#/$defs/runtime"}, "fixedIdentity":{"type":"array","minItems":8,"maxItems":8,"items":{"$ref":"#/$defs/fixed"}}, "loader":{"$ref":"#/$defs/loader"}, "node":{"$ref":"#/$defs/node"}, "dsos":{"type":"array","minItems":6,"maxItems":6,"items":{"$ref":"#/$defs/dso"}}
  },
  "$defs":{
    "runtime":{"type":"object","additionalProperties":false,"required":["runtime","version","platform","arch"],"properties":{"runtime":{"const":"node"},"version":{"const":"v22.23.1"},"platform":{"const":"linux"},"arch":{"const":"x64"}}},
    "elf":{"type":"object","additionalProperties":false,"required":["ptInterp","dtNeeded","soname","rpath","runpath"],"properties":{"ptInterp":{"type":["string","null"]},"dtNeeded":{"type":"array","items":{"type":"string"}},"soname":{"type":["string","null"]},"rpath":{"type":["string","null"]},"runpath":{"type":["string","null"]}}},
    "fixed":{"type":"object","additionalProperties":false,"required":["id","path","bytes","sha256","mode","elf"],"properties":{"id":{"type":"string"},"path":{"type":"string"},"bytes":{"type":"integer"},"sha256":{"type":"string","pattern":"^[0-9a-f]{64}$"},"mode":{"type":"integer"},"elf":{"$ref":"#/$defs/elf"}}},
    "loader":{"type":"object","additionalProperties":false,"required":["id","path","realpath","bytes","sha256","mode","nlink","elf","usedBy"],"properties":{"id":{"const":"loader"},"path":{"type":"string"},"realpath":{"type":"string"},"bytes":{"type":"integer"},"sha256":{"type":"string","pattern":"^[0-9a-f]{64}$"},"mode":{"type":"integer"},"nlink":{"const":1},"elf":{"$ref":"#/$defs/elf"},"usedBy":{"type":"array","items":{"type":"string"}}}},
    "node":{"type":"object","additionalProperties":false,"required":["id","path","realpath","bytes","sha256","mode","nlink","elf"],"properties":{"id":{"const":"node"},"path":{"type":"string"},"realpath":{"type":"string"},"bytes":{"type":"integer"},"sha256":{"type":"string","pattern":"^[0-9a-f]{64}$"},"mode":{"type":"integer"},"nlink":{"const":1},"elf":{"$ref":"#/$defs/elf"}}},
    "dso":{"type":"object","additionalProperties":false,"required":["id","soname","path","realpath","bytes","sha256","mode","nlink","elf","usedBy"],"properties":{"id":{"type":"string"},"soname":{"type":"string"},"path":{"type":"string"},"realpath":{"type":"string"},"bytes":{"type":"integer"},"sha256":{"type":"string","pattern":"^[0-9a-f]{64}$"},"mode":{"type":"integer"},"nlink":{"const":1},"elf":{"$ref":"#/$defs/elf"},"usedBy":{"type":"array","items":{"type":"string"}}}}
  }
}
