{"dsos":[{"bytes":14352,"elf":{"dtNeeded":["libc.so.6"],"ptInterp":null,"rpath":null,"runpath":null,"soname":"libdl.so.2"},"id":"dso:libdl.so.2","mode":493,"nlink":1,"path":"/usr/lib/libdl.so.2","realpath":"/usr/lib/libdl.so.2","sha256":"20160c529bfd255fd820273cfed23698f4a70e5d80e4d9ad1f580ab9ce5e2463","soname":"libdl.so.2","usedBy":["node"]},{"bytes":2935832,"elf":{"dtNeeded":["libm.so.6","libc.so.6","ld-linux-x86-64.so.2","libgcc_s.so.1"],"ptInterp":null,"rpath":null,"runpath":null,"soname":"libstdc++.so.6"},"id":"dso:libstdc++.so.6","mode":493,"nlink":1,"path":"/usr/lib/libstdc++.so.6","realpath":"/usr/lib/libstdc++.so.6.0.35","sha256":"2c0ec5cdcaa4a044329ad19ba40b73e3e61c16b3f00f5c8184b0d72816480614","soname":"libstdc++.so.6","usedBy":["node"]},{"bytes":1251952,"elf":{"dtNeeded":["libc.so.6","ld-linux-x86-64.so.2"],"ptInterp":null,"rpath":null,"runpath":null,"soname":"libm.so.6"},"id":"dso:libm.so.6","mode":493,"nlink":1,"path":"/usr/lib/libm.so.6","realpath":"/usr/lib/libm.so.6","sha256":"8f85ea3a02885cda4ecff8758e6e758c69ccaa25b6580cb97b5713ac512f0a1b","soname":"libm.so.6","usedBy":["node","libstdc++.so.6"]},{"bytes":182512,"elf":{"dtNeeded":["libc.so.6","ld-linux-x86-64.so.2"],"ptInterp":null,"rpath":null,"runpath":null,"soname":"libgcc_s.so.1"},"id":"dso:libgcc_s.so.1","mode":420,"nlink":1,"path":"/usr/lib/libgcc_s.so.1","realpath":"/usr/lib/libgcc_s.so.1","sha256":"0c6c78d4632bf37a274e053fea871f35b06f0578644593a291ca1ee0f12dffbb","soname":"libgcc_s.so.1","usedBy":["node","libstdc++.so.6"]},{"bytes":14360,"elf":{"dtNeeded":["libc.so.6"],"ptInterp":null,"rpath":null,"runpath":null,"soname":"libpthread.so.0"},"id":"dso:libpthread.so.0","mode":493,"nlink":1,"path":"/usr/lib/libpthread.so.0","realpath":"/usr/lib/libpthread.so.0","sha256":"efd89a5cf95482cd92f1230320e95c3ab5f1f27bbf099fd166db36e2122a2882","soname":"libpthread.so.0","usedBy":["node"]},{"bytes":2186528,"elf":{"dtNeeded":["ld-linux-x86-64.so.2"],"ptInterp":"/usr/lib/ld-linux-x86-64.so.2","rpath":null,"runpath":null,"soname":"libc.so.6"},"id":"dso:libc.so.6","mode":493,"nlink":1,"path":"/usr/lib/libc.so.6","realpath":"/usr/lib/libc.so.6","sha256":"9bf40a540836d90c7d46c95eeb222a217597834eea29ab9e537428317c021c3a","soname":"libc.so.6","usedBy":["node","libdl.so.2","libstdc++.so.6","libm.so.6","libgcc_s.so.1","libpthread.so.0"]}],"fixedIdentity":[{"bytes":246760,"elf":{"dtNeeded":[],"ptInterp":null,"rpath":null,"runpath":null,"soname":"ld-linux-x86-64.so.2"},"id":"loader","mode":493,"path":"image/root/lib64/ld-linux-x86-64.so.2","sha256":"d52fe2ff87fff536ed5c5eae8e954cb50655884e4709fedd24cf57f9ec98ad80"},{"bytes":124835376,"elf":{"dtNeeded":["libdl.so.2","libstdc++.so.6","libm.so.6","libgcc_s.so.1","libpthread.so.0","libc.so.6","ld-linux-x86-64.so.2"],"ptInterp":"/lib64/ld-linux-x86-64.so.2","rpath":null,"runpath":null,"soname":null},"id":"node","mode":493,"path":"image/root/bin/node","sha256":"93956de2e59480474a7b46571da1651180b1a050cdf32641ebec4ce6e478e068"},{"bytes":14352,"elf":{"dtNeeded":["libc.so.6"],"ptInterp":null,"rpath":null,"runpath":null,"soname":"libdl.so.2"},"id":"libdl.so.2","mode":493,"path":"image/root/usr/lib/libdl.so.2","sha256":"20160c529bfd255fd820273cfed23698f4a70e5d80e4d9ad1f580ab9ce5e2463"},{"bytes":2935832,"elf":{"dtNeeded":["libm.so.6","libc.so.6","ld-linux-x86-64.so.2","libgcc_s.so.1"],"ptInterp":null,"rpath":null,"runpath":null,"soname":"libstdc++.so.6"},"id":"libstdc++.so.6","mode":493,"path":"image/root/usr/lib/libstdc++.so.6","sha256":"2c0ec5cdcaa4a044329ad19ba40b73e3e61c16b3f00f5c8184b0d72816480614"},{"bytes":1251952,"elf":{"dtNeeded":["libc.so.6","ld-linux-x86-64.so.2"],"ptInterp":null,"rpath":null,"runpath":null,"soname":"libm.so.6"},"id":"libm.so.6","mode":493,"path":"image/root/usr/lib/libm.so.6","sha256":"8f85ea3a02885cda4ecff8758e6e758c69ccaa25b6580cb97b5713ac512f0a1b"},{"bytes":182512,"elf":{"dtNeeded":["libc.so.6","ld-linux-x86-64.so.2"],"ptInterp":null,"rpath":null,"runpath":null,"soname":"libgcc_s.so.1"},"id":"libgcc_s.so.1","mode":420,"path":"image/root/usr/lib/libgcc_s.so.1","sha256":"0c6c78d4632bf37a274e053fea871f35b06f0578644593a291ca1ee0f12dffbb"},{"bytes":14360,"elf":{"dtNeeded":["libc.so.6"],"ptInterp":null,"rpath":null,"runpath":null,"soname":"libpthread.so.0"},"id":"libpthread.so.0","mode":493,"path":"image/root/usr/lib/libpthread.so.0","sha256":"efd89a5cf95482cd92f1230320e95c3ab5f1f27bbf099fd166db36e2122a2882"},{"bytes":2186528,"elf":{"dtNeeded":["ld-linux-x86-64.so.2"],"ptInterp":"/usr/lib/ld-linux-x86-64.so.2","rpath":null,"runpath":null,"soname":"libc.so.6"},"id":"libc.so.6","mode":493,"path":"image/root/usr/lib/libc.so.6","sha256":"9bf40a540836d90c7d46c95eeb222a217597834eea29ab9e537428317c021c3a"}],"loader":{"bytes":246760,"elf":{"dtNeeded":[],"ptInterp":null,"rpath":null,"runpath":null,"soname":"ld-linux-x86-64.so.2"},"id":"loader","mode":493,"nlink":1,"path":"/usr/lib/ld-linux-x86-64.so.2","realpath":"/usr/lib/ld-linux-x86-64.so.2","sha256":"d52fe2ff87fff536ed5c5eae8e954cb50655884e4709fedd24cf57f9ec98ad80","usedBy":["node","libstdc++.so.6","libm.so.6","libgcc_s.so.1","libc.so.6"]},"materialized":true,"nativeAddons":false,"noHostFallback":true,"node":{"bytes":124835376,"elf":{"dtNeeded":["libdl.so.2","libstdc++.so.6","libm.so.6","libgcc_s.so.1","libpthread.so.0","libc.so.6","ld-linux-x86-64.so.2"],"ptInterp":"/lib64/ld-linux-x86-64.so.2","rpath":null,"runpath":null,"soname":null},"id":"node","mode":493,"nlink":1,"path":"/home/toorik/.local/share/mise/installs/node/22.23.1/bin/node","realpath":"/home/toorik/.local/share/mise/installs/node/22.23.1/bin/node","sha256":"93956de2e59480474a7b46571da1651180b1a050cdf32641ebec4ce6e478e068"},"runtime":{"arch":"x64","platform":"linux","runtime":"node","version":"v22.23.1"},"schema":"shieldkit-labs/p2/gate-b/cohort-node-runtime-materialized/v1/source","status":"materialized-package-local"}
